Author,doi,title,year of publication,year of sample collection,corrected year,study focus,sample size Nigeria only,state,city,haplotypes found,CVMNK,CVIET,CVMNK/CVIET,CVMNT,CVIEK,CVMET,CVMDT,CVMNN,CVINK,CVMEK,CVIKT,sum of haplotype prevalences
Saito-Nakano,10.1186/1475-2875-10-388,Identification of pyrimethamine- and chloroquine-resistant Plasmodium falciparum in Africa between 1984 and 1998: genotyping of archive blood samples,2011,1984-1998,1991,,14,,,"CVMNK, CVIET",0.21,0.43,0.36,,,,,,,,,1.0
Oladipu,10.1186/s13000-015-0276-2,"Persistence of chloroquine-resistant haplotypes of Plasmodium falciparum in children with uncomplicated Malaria in Lagos, Nigeria, four years after change of chloroquine as first-line antimalarial medicine",2015,2007-2008,2007,0-12,119,Lagos,Lekki and Lagos Island,"CVMNK, CVIET",0.042,0.916,0.042,,,,,,,,,1.0
Balogun,10.3855/jidc.6853,"Carriage of Mutant Dihydrofolate Reductase and Dihydropteroate Synthase Genes among Plasmodium falciparum Isolates Recovered from Pregnant Women with Asymptomatic Infection in Lagos, Nigeria",2016,2010-2010,2010,3-12 years,56,Borno,Maiduguri,"CVMNK, CVIET",0.946,0.054,,,,,,,,,,1.0
Yao,10.1128/AAC.02387-17,"Surveillance of Genetic Variations Associated with Antimalarial Resistance of Plasmodium falciparum Isolates from Returned Migrant Workers in Wuhan, Central China",2018,2011-2016,2014,NA returning traveler,29,Wuhan,,"CVMNK, CVIET",0.52,0.16,0.32,,,,,,,,,1.0
Zhou,10.1186/s12936-016-1306-6,Molecular mutation profile of pfcrt in Plasmodium falciparum isolates imported from Africa in Henan province,2016,2012-2015,2014,,74,Henan,,"CVMNK, CVIET, CVIEK",0.54,0.42,0.027,0.01,,,,,,,,0.997
Zhao,10.3389/fcimb.2021.644576,"Surveillance of Antimalarial Drug-Resistance Genes in Imported Plasmodium falciparum Isolates From Nigeria in Henan, China, 2012‚Äö√Ñ√¨2019",2021,2012-2019,2016,NA returning traveler,167,Henan,,"CVMNK, CVIET, CVIEK",0.639,0.323,0.032,,0.006,,,,,,,1.0
Tola,10.1186/s13104-020-05334-5,"Molecular detection of drug resistant polymorphisms in Plasmodium falciparum isolates from Southwest, Nigeria",2020,2014-2014,2014,1-61 years,83,Lagos; Osun,Badagry; Alajue village Ede,"CVMNK, CVIET",0.45,0.55,,,,,,,,,,1.0
Idowu,10.1186/s12936-019-2947-z,Rare mutations in Pfmdr1 gene of Plasmodium falciparum detected in clinical isolates from patients treated with anti-malarial drug in Nigeria,2019,2015-2016,2015,,37,Lagos,,"CVMNK, CVIET, CVMET",0.654,0.308,,,,0.038,,,,,,1.0
Kong,10.1186/s12936-022-04398-x,Molecular surveillance of artemisinin resistance‚Äö√Ñ√´related Pfk13 and pfcrt polymorphisms in imported Plasmodium falciparum isolates reported in eastern China from 2015 to 2019,2022,2015-2019,2017,NA returning traveler,88,Shandong Province,,"CVMNK, CVIET",0.85,0.03,,0.08,,,,,,0.02,0.01,0.99
Zhang,10.4269/ajtmh.17-0864,"Surveillance of Antimalarial Resistance Molecular Markers in Imported Plasmodium falciparum Malaria Cases in Anhui, China, 2012‚Äö√Ñ√¨2016",2018,2016-2016,2016,NA returning traveler,46,Anhui,,data not shown as haplotypes,,,,,,,,,,,,0.0
Beshir,10.1016/S1473-3099(22)00593-X,Prevalence of Plasmodium falciparum haplotypes associated with resistance to sulfadoxine‚Äö√Ñ√¨pyrimethamine and amodiaquine before and after upscaling of seasonal malaria chemoprevention in seven African countries: a genomic surveillance study,2023,2016-2016,2016,0-30,1096,Zamfara,Anka,"CVIET, CVMNK",0.884,0.116,,,,,,,,,,1.0
Wang,10.1186/s12936-020-3140-0,"Molecular surveillance of Pfcrt and k13 propeller polymorphisms of imported Plasmodium falciparum cases to Zhejiang Province, China between 2016 and 2018",2020,2016-2018,2017,NA returning traveler,118,Zhejiang,,"CVMNK, CVIET",0.6271,0.3136,0.0593,,,,,,,,,1.0
Foguim,10.1186/s12936-020-03281-x,"Prevalence of mutations in the Plasmodium falciparum chloroquine resistance transporter, PfCRT, and association with ex vivo susceptibility to common anti‚Äö√Ñ√´malarial drugs against African Plasmodium falciparum isolates",2020,2017-2018,2017,NA returning traveler,16,,Marseille,"CVMNK, CVIET",0.54,0.46,0.0,,,,,,,,,1.0
Cheng,10.1186/s12936-021-03737-8,"Molecular surveillance of anti‚Äö√Ñ√´malarial resistance pfcrt, pfmdr1, and pfk13 polymorphisms in African Plasmodium falciparum imported parasites to Wuhan, China",2021,2017-2019,2018,NA returning traveler,18,,Wuhan,"CVMNK, CVIET",0.8889,0.0556,0.0556,,,,,,,,,1.0001
Beshir,10.1016/S1473-3099(22)00593-X,Prevalence of Plasmodium falciparum haplotypes associated with resistance to sulfadoxine‚Äö√Ñ√¨pyrimethamine and amodiaquine before and after upscaling of seasonal malaria chemoprevention in seven African countries: a genomic surveillance study,2023,2018-2018,2018,0-30,615,Zamfara,Anka,"CVIET, CVMNK",0.636,0.364,,,,,,,,,,1.0
Ajibaye,10.3389/fcimb.2024.1366563,Detection of novel Plasmodium falciparum coronin gene mutations in a recrudescent ACT-treated patient in South-Western Nigeria,2024,2019-2019,2019,12 months to <70 years,7,Lagos,Ijede General hospital (IJGH),CVIET,0.0,1.0,,,,,,,,,,1.0
Ibekpobaoku,10.1186/s13104-024-06763-2,Sub-microscopic Plasmodium falciparum infections and multiple drug resistant single nucleotide polymorphic alleles in pregnant women from southwestern Nigeria,2024,2019-2021,2020,pregnant women,7,Lagos,Lagos,"CMNK, CVIET",0.714,0.143,0.143,,,,,,,,,1.0
Folarin,10.1016/j.actatropica.2011.08.013,In vitro Amodiaquine Resistance and its Association with Mutations in pfcrt and pfmdr1 genes of Plasmodium falciparum isolates from Nigeria,2011,,2011,0.5-12,107,Oyo,Ibadan,"CVMNK, CVIET, CVMNT",0.23,0.72,,0.05,,,,,,,,1.0
Bustamante,10.1093/infdis/jis359,In vitro-reduced susceptibility to artemether in P. falciparum and its association with polymorphisms on transporter genes,2011,,2011,0.5-12,109,Oyo,Ibadan,"CVMNK, CVMNT, CVIET",0.27,0.7,,0.03,,,,,,,,1.0
Van Schalkwyk,10.1186/1475-2875-12-320,"Culture-adapted Plasmodium falciparum isolates from UK travellers: in vitro drug sensitivity, clonality and drug resistance markers",2012,,2012,na,2,,London,"CVMNK, CVIET",,0.5,0.5,,,,,,,,,1.0
Agomo,10.1371/journal.pone.0146908,"Assessment of Markers of Antimalarial Drug Resistance in Plasmodium falciparum Isolates from Pregnant Women in Lagos, Nigeria",2016,,2016,,54,Lagos,,"CVMNK, CVIET",0.24,0.54,0.22,,,,,,,,,1.0
Gbotosho,10.4269/ajtmh.2012.11-0368,Short Report: Different Patterns of pfcrt and pfmdr1 Polymorphisms in P. falciparum Isolates from Nigeria and Brazil: The Potential Role of Antimalarial Drug Selection Pressure,2012,,2012,6 months-12 years of age TES,70,Oyo,Ibadan,"CVMNK, CVIET, CVMNT",0.21,0.72,,0.07,,,,,,,,1.0
Wang,10.1128/spectrum.00528-22,Molecular Epidemiology of Drug Resistance Genes in Plasmodium falciparum Isolates Imported from Nigeria between 2016 and 2020: Continued Emergence of Fully Resistant Pfdhfr- Pfdhps Alleles,2022,2016,2016,returning traveler,51,Zhejiang Province,,"CVMNK, CVIET",0.6741,0.333,0.0196,,,,,,,,,1.0267
Wang,10.1128/spectrum.00528-22,Molecular Epidemiology of Drug Resistance Genes in Plasmodium falciparum Isolates Imported from Nigeria between 2016 and 2020: Continued Emergence of Fully Resistant Pfdhfr- Pfdhps Alleles,2022,2017,2017,returning traveler,41,Zhejiang,,"CVMNK, CVIET",0.5366,0.3902,0.0732,,,,,,,,,1.0
Wang,10.1128/spectrum.00528-22,Molecular Epidemiology of Drug Resistance Genes in Plasmodium falciparum Isolates Imported from Nigeria between 2016 and 2020: Continued Emergence of Fully Resistant Pfdhfr- Pfdhps Alleles,2022,2018,2018,returning traveler,28,Zhejiang Province,,"CVMNK, CVIET",0.7857,0.1429,0.0714,,,,,,,,,1.0
Wang,10.1128/spectrum.00528-22,Molecular Epidemiology of Drug Resistance Genes in Plasmodium falciparum Isolates Imported from Nigeria between 2016 and 2020: Continued Emergence of Fully Resistant Pfdhfr- Pfdhps Alleles,2022,2019,2019,returning traveler,29,Zhejiang Province,,"CVMNK, CVIET",0.6552,0.275,0.069,,,,,,,,,0.9992
Wang,10.1128/spectrum.00528-22,Molecular Epidemiology of Drug Resistance Genes in Plasmodium falciparum Isolates Imported from Nigeria between 2016 and 2020: Continued Emergence of Fully Resistant Pfdhfr- Pfdhps Alleles,2022,2020,2020,returning traveler,4,Zhejiang Province,,"CVMNK, CVIET",1.0,0.0,0.0,,,,,,,,,1.0
Oboh,10.1016/j.meegid.2018.10.007,Molecular epidemiology and evolution of drug-resistant genes in the malaria parasite Plasmodium falciparum in southwestern Nigeria,2018,2016-2017,2016,<2 years (children),41,Edo,,"CVMNK, CVIET, CVINK, CVMEK",0.366,0.586,,,,,,,0.024,0.024,,1.0
Oboh,10.1016/j.meegid.2018.10.007,Molecular epidemiology and evolution of drug-resistant genes in the malaria parasite Plasmodium falciparum in southwestern Nigeria,2018,2016-2017,2016,<2 years (children),41,Lagos,,"CVMNK, CVIET, CVMET, CVMDT, CVMNN",0.4,0.558,,,,0.014,0.014,0.014,,,,1.0
Kayode,10.1016/j.ijpara.2020.10.001,Polymorphisms in Plasmodium falciparum chloroquine resistance transporter (Pfcrt) and multidrug-resistant gene 1 (Pfmdr-1) in Nigerian children 10 years post-adoption of artemisinin-based combination treatments,2021,2014-2015,2014,<5 years (children),50,Adamawa,,"CVMNK, CVIET",0.833,0.083,0.083,,,,,,,,,0.999
Kayode,10.1016/j.ijpara.2020.10.001,Polymorphisms in Plasmodium falciparum chloroquine resistance transporter (Pfcrt) and multidrug-resistant gene 1 (Pfmdr-1) in Nigerian children 10 years post-adoption of artemisinin-based combination treatments,2021,2014-2015,2014,<5 years (children),43,Bayelsa,,"CVMNK, CVIET",0.0,0.977,0.0,,,,,,,,,0.977
Kayode,10.1016/j.ijpara.2020.10.001,Polymorphisms in Plasmodium falciparum chloroquine resistance transporter (Pfcrt) and multidrug-resistant gene 1 (Pfmdr-1) in Nigerian children 10 years post-adoption of artemisinin-based combination treatments,2021,2014-2015,2014,<5 years (children),77,Imo,,"CVMNK, CVIET",0.052,0.935,0.013,,,,,,,,,1.0
Kayode,10.1016/j.ijpara.2020.10.001,Polymorphisms in Plasmodium falciparum chloroquine resistance transporter (Pfcrt) and multidrug-resistant gene 1 (Pfmdr-1) in Nigerian children 10 years post-adoption of artemisinin-based combination treatments,2021,2014-2015,2014,<5 years (children),77,Kwara,,"CVMNK, CVIET",0.8,0.133,0.067,,,,,,,,,1.0
Kayode,10.1016/j.ijpara.2020.10.001,Polymorphisms in Plasmodium falciparum chloroquine resistance transporter (Pfcrt) and multidrug-resistant gene 1 (Pfmdr-1) in Nigerian children 10 years post-adoption of artemisinin-based combination treatments,2021,2014-2015,2014,<5 years (children),42,Sokoto,,"CVMNK, CVIET",0.833,0.167,,,,,,,,,,1.0
Martín Ramírez,10.1186/s41182-025-00732-6,"Mutational profile of pfdhfr, pfdhps, pfmdr1, pfcrt and pfk13 genes of P. falciparum associated with resistance to different antimalarial drugs in Osun state, southwestern Nigeria",2025,2021,2021,children,297,Osun,Ore,"CVMNK, CVIET, CVMNT",0.8418,0.0909,0.0303,0.037,,,,,,,,1.0
Ibekpobaoku,10.1186/s13104-024-06763-2,Sub-microscopic Plasmodium falciparum infections and multiple drug resistant single nucleotide polymorphic alleles in pregnant women from southwestern Nigeria,2024,2019-2021,2020,pregnant women,7,Lagos,Lagos,"CMNK, CVIET",0.714,0.143,0.143,,,,,,,,,1.0
Ibekpobaoku,10.1186/s13104-024-06763-2,Sub-microscopic Plasmodium falciparum infections and multiple drug resistant single nucleotide polymorphic alleles in pregnant women from southwestern Nigeria,2024,2019-2021,2020,Pregnant Women,121,Lagos,Lagos,"CVMNK, CVIET",0.714,0.143,0.143,,,,,,,,,1.0
Amusan,10.1016/j.actatropica.2024.107435,"Frequency of chloroquine-resistant haplotype of Plasmodium falciparum (CVIET) in Ibadan, Southwest Nigeria 17 years post-chloroquine withdrawal",2024,2021,2021,mixed age,42,Oyo,Ibadan,"CVMNK, CVIET, CVMNT",0.81,0.19,,,,,,,,,,1.0
